Rank,ChEMBL_ID,Name,MW,Original_Indication,Combined_Score,Shape_Score,Size_Score,Allosteric_Score,SMILES
1,CHEMBL21,SULFANILAMIDE,172.2,Bacterial Infections,0.8174,0.8356,0.9926,0.4303,Nc1ccc(S(N)(=O)=O)cc1
2,CHEMBL3,NICOTINE,162.2,Tobacco Use Disorder; Smoking Cessation; Memory Disorders,0.7791,0.7614,0.9566,0.4598,CN1CCC[C@H]1c1cccnc1
3,CHEMBL427,MECHLORETHAMINE,156.1,Hodgkin Disease; Lymphoma; Mycosis Fungoides,0.7739,0.7429,0.9873,0.4092,CN(CCCl)CCCl
4,CHEMBL419,MAFENIDE,186.2,Osteomyelitis,0.748,0.7609,0.8856,0.4472,NCc1ccc(S(N)(=O)=O)cc1
5,CHEMBL459,METHYLDOPA,211.2,"Pre-Eclampsia; Hypertension; Diabetes Mellitus, Type 1",0.7352,0.7274,0.8724,0.4763,C[C@](N)(Cc1ccc(O)c(O)c1)C(=O)O
6,CHEMBL17,DICHLORPHENAMIDE,305.2,"Myotonic Disorders; Hypokalemic Periodic Paralysis; Paralysis, Hyperkalemic Periodic",0.7145,0.5581,0.977,0.5021,NS(=O)(=O)c1cc(Cl)c(Cl)c(S(N)(=O)=O)c1
7,CHEMBL435,HYDROCHLOROTHIAZIDE,297.8,"Hypertension; Cardiovascular Diseases; Kidney Failure, Chronic",0.7127,0.7032,0.8366,0.4838,NS(=O)(=O)c1cc2c(cc1Cl)NCNS2(=O)=O
8,CHEMBL14,CARBACHOL,182.7,Presbyopia; Miosis; Cataract,0.709,0.7391,0.8049,0.4571,C[N+](C)(C)CCOC(N)=O.[Cl-]
9,CHEMBL416,METHOXSALEN,216.2,Lymphoma; Mycosis Fungoides; Graft vs Host Disease,0.6967,0.7265,0.7707,0.4889,COc1c2occc2cc2ccc(=O)oc12
10,CHEMBL25,ASPIRIN,180.2,Atrial Fibrillation; Duodenal Ulcer; Fever,0.6961,0.5049,0.9695,0.5317,CC(=O)Oc1ccccc1C(=O)O
11,CHEMBL433,VALPROATE SODIUM,166.2,Epilepsy; Seizures; Neuralgia,0.695,0.4656,1.0,0.5438,CCCC(CCC)C(=O)[O-].[Na+]
12,CHEMBL449,BUTABARBITAL,212.2,Unknown,0.6885,0.3776,0.9868,0.7134,CCC(C)C1(CC)C(=O)NC(=O)NC1=O
13,CHEMBL7863,APROBARBITAL,210.2,Unknown,0.6883,0.471,0.968,0.5634,C=CCC1(C(C)C)C(=O)NC(=O)NC1=O
14,CHEMBL40,PHENOBARBITAL,232.2,Epilepsy; Seizures; Neonatal Abstinence Syndrome,0.6877,0.4612,0.964,0.5879,CCC1(c2ccccc2)C(=O)NC(=O)NC1=O
15,CHEMBL450,METHARBITAL,198.2,Epilepsy,0.6844,0.4314,0.9916,0.5761,CCC1(CC)C(=O)NC(=O)N(C)C1=O
16,CHEMBL268164,CYCLOBARBITAL,236.3,Unknown,0.6796,0.5147,0.9122,0.5444,CCC1(C2=CCCCC2)C(=O)NC(=O)NC1=O
17,CHEMBL403,SULBACTAM,233.2,Infections; Osteomyelitis; Cleft Palate,0.6767,0.3842,0.9775,0.6604,CC1(C)[C@H](C(=O)O)N2C(=O)C[C@H]2S1(=O)=O
18,CHEMBL267936,MECAMYLAMINE,167.3,Hypertension; Macular Degeneration; Tobacco Use Disorder,0.6658,0.4009,0.9411,0.645,CNC1(C)C2CCC(C2)C1(C)C
19,CHEMBL7728,HEXOBARBITAL,236.3,Unknown,0.6656,0.6381,0.7688,0.5144,CN1C(=O)NC(=O)C(C)(C2=CCCCC2)C1=O
20,CHEMBL6622,ISOSORBIDE DINITRATE,236.1,Cardiovascular Diseases; Heart Failure; Diabetic Foot,0.6591,0.7331,0.6884,0.4524,O=[N+]([O-])O[C@H]1CO[C@H]2[C@@H]1OC[C@H]2O[N+](=O)[O-]
21,CHEMBL454,BUTALBITAL,224.3,Migraine Disorders,0.6557,0.4085,0.9134,0.635,C=CCC1(CC(C)C)C(=O)NC(=O)NC1=O
22,CHEMBL267894,AMOBARBITAL,226.3,Osteoarthritis,0.654,0.5126,0.8488,0.5472,CCC1(CCC(C)C)C(=O)NC(=O)NC1=O
23,CHEMBL455,SULFACETAMIDE,214.2,Osteomyelitis; Acne Vulgaris; Eye Infections,0.648,0.8706,0.5261,0.4463,CC(=O)NS(=O)(=O)c1ccc(N)cc1
24,CHEMBL448,PENTOBARBITAL,226.3,Heart Diseases; Substance-Related Disorders; Status Epilepticus,0.6359,0.5326,0.7833,0.5478,CCCC(C)C1(CC)C(=O)NC(=O)NC1=O
25,CHEMBL19,METHAZOLAMIDE,236.3,"Altitude Sickness; Uterine Cervical Neoplasms; Glaucoma, Open-Angle",0.6328,0.7719,0.5882,0.4439,CC(=O)/N=c1/sc(S(N)(=O)=O)nn1C
26,CHEMBL447,SECOBARBITAL,238.3,Unknown,0.6276,0.4362,0.8308,0.604,C=CCC1(C(C)CCC)C(=O)NC(=O)NC1=O
27,CHEMBL441,THIOPENTAL,242.3,"Shock, Septic; Status Epilepticus; Strabismus",0.6263,0.5797,0.7237,0.5247,CCCC(C)C1(CC)C(=O)NC(=S)NC1=O
28,CHEMBL16,PHENYTOIN,252.3,Epilepsy; Seizures; Wounds and Injuries,0.6095,0.4165,0.7891,0.6362,O=C1NC(=O)C(c2ccccc2)(c2ccccc2)N1
29,CHEMBL434,ISOPROTERENOL,211.3,Atrial Fibrillation; Cardiovascular Diseases; Lipoma,0.5963,0.8317,0.4425,0.4333,CC(C)NCC(O)c1ccc(O)c(O)c1
30,CHEMBL452,CLONAZEPAM,315.7,Neuralgia; Epilepsy; Pain,0.5917,0.4233,0.7319,0.648,O=C1CN=C(c2ccccc2Cl)c2cc([N+](=O)[O-])ccc2N1
31,CHEMBL36,PYRIMETHAMINE,248.7,"Amyotrophic Lateral Sclerosis; Pregnancy; Leukemia, Lymphocytic, Chronic, B-Cell",0.5896,0.8421,0.416,0.4319,CCc1nc(N)nc(N)c1-c1ccc(Cl)cc1
32,CHEMBL268869,SULFAMETHOXYPYRIDAZINE,280.3,Bacterial Infections,0.5881,0.5015,0.6928,0.552,COc1ccc(NS(=O)(=O)c2ccc(N)cc2)nn1
33,CHEMBL20,ACETAZOLAMIDE,222.2,Kidney Diseases; Andersen Syndrome; Altitude Sickness,0.5833,0.7224,0.519,0.4337,CC(=O)Nc1nnc(S(N)(=O)=O)s1
34,CHEMBL5,NALIDIXIC ACID,232.2,Osteomyelitis; Bacterial Infections,0.5782,0.679,0.5307,0.4717,CCn1cc(C(=O)O)c(=O)c2ccc(C)nc21
35,CHEMBL404,TAZOBACTAM,300.3,Infections; Pseudomonas Infections; Abscess,0.5699,0.47,0.6585,0.5923,C[C@]1(Cn2ccnn2)[C@H](C(=O)O)N2C(=O)C[C@H]2S1(=O)=O
36,CHEMBL30,CIMETIDINE,252.3,Gastroesophageal Reflux; Peptic Ulcer; Hemorrhage,0.5607,0.7116,0.4601,0.4598,CN/C(=N\CCSCc1nc[nH]c1C)NC#N
37,CHEMBL457,GEMFIBROZIL,250.3,Coronary Disease; Tobacco Use Disorder; Anemia,0.5426,0.8005,0.3389,0.434,Cc1ccc(C)c(OCCCC(C)(C)C(=O)O)c1
38,CHEMBL29,PENICILLIN G,334.4,Osteomyelitis; Rheumatic Heart Disease; Syphilis,0.5398,0.63,0.4773,0.4842,CC1(C)S[C@@H]2[C@H](NC(=O)Cc3ccccc3)C(=O)N2[C@H]1C(=O)O
39,CHEMBL420,GUANABENZ,231.1,"Multiple Sclerosis, Relapsing-Remitting; Multiple Sclerosis",0.5378,0.6971,0.4191,0.4568,N=C(N)N/N=C/c1c(Cl)cccc1Cl
40,CHEMBL439,SULFADIAZINE,250.3,"Osteomyelitis; Toxoplasmosis, Cerebral; Toxoplasmosis, Congenital",0.531,0.634,0.4561,0.4749,Nc1ccc(S(=O)(=O)Nc2ncccn2)cc1
41,CHEMBL12,DIAZEPAM,284.8,Epilepsy; Seizures; Anxiety,0.5309,0.4647,0.5691,0.5871,CN1C(=O)CN=C(c2ccccc2)c2cc(Cl)ccc21
42,CHEMBL443,SULFAMETHOXAZOLE,253.3,Infections; Neoplasms; Idiopathic Pulmonary Fibrosis,0.5126,0.5933,0.4457,0.4851,Cc1cc(NS(=O)(=O)c2ccc(N)cc2)no1
43,CHEMBL6437,MIANSERIN,264.4,Anxiety; Dementia; Depressive Disorder,0.5091,0.4891,0.5061,0.5551,CN1CCN2c3ccccc3Cc3ccccc3C2C1
44,CHEMBL406,INDAPAMIDE,365.8,Hypertension; Cardiovascular Diseases; Heart Failure,0.4953,0.8664,0.1689,0.4057,CC1Cc2ccccc2N1NC(=O)c1ccc(Cl)c(S(N)(=O)=O)c1
45,CHEMBL415,CLOMIPRAMINE,314.9,Obsessive-Compulsive Disorder; Anxiety; Dementia,0.489,0.4646,0.4809,0.5541,CN(C)CCCN1c2ccccc2CCc2ccc(Cl)cc21
46,CHEMBL451,CHLORDIAZEPOXIDE,299.8,"Anxiety; Substance Withdrawal Syndrome; Depressive Disorder, Major",0.4879,0.4659,0.4664,0.5746,CNC1=Nc2ccc(Cl)cc2C(c2ccccc2)=[N+]([O-])C1
47,CHEMBL456,ETHACRYNIC ACID,303.1,Cardiovascular Diseases; Urinary Bladder Neoplasms; Heart Failure,0.4855,0.6289,0.3505,0.4688,C=C(CC)C(=O)c1ccc(OCC(=O)O)c(Cl)c1Cl
48,CHEMBL453,SULFISOXAZOLE,267.3,Osteomyelitis; Bacterial Infections; Eye Infections,0.4837,0.7324,0.2596,0.4344,Cc1noc(NS(=O)(=O)c2ccc(N)cc2)c1C
49,CHEMBL438,SULFAMERAZINE,264.3,Bacterial Infections,0.4766,0.7198,0.2538,0.4356,Cc1ccnc(NS(=O)(=O)c2ccc(N)cc2)n1
50,CHEMBL11,IMIPRAMINE,280.4,Gastroesophageal Reflux; Anxiety; Dementia,0.4756,0.4961,0.4282,0.5294,CN(C)CCCN1c2ccccc2CCc2ccccc21
51,CHEMBL437,SULFATHIAZOLE,255.3,Bacterial Infections,0.4745,0.789,0.1958,0.403,Nc1ccc(S(=O)(=O)Nc2nccs2)cc1
52,CHEMBL460,MOLINDONE,276.4,Psychotic Disorders; Attention Deficit Disorder with Hyperactivity,0.4726,0.7578,0.2111,0.4253,CCc1c(C)[nH]c2c1C(=O)C(CN1CCOCC1)CC2
53,CHEMBL440,THIAMYLAL,254.3,Unknown,0.4715,0.424,0.4584,0.5926,C=CCC1(C(C)CCC)C(=O)NC(=S)NC1=O
54,CHEMBL41,FLUOXETINE,309.3,Stroke; Fibromyalgia; Autistic Disorder,0.4664,0.8593,0.1086,0.3963,CNCCC(Oc1ccc(C(F)(F)F)cc1)c1ccccc1
55,CHEMBL45,MELATONIN,232.3,Sunburn; Substance Withdrawal Syndrome; Aortic Aneurysm,0.4643,0.819,0.1424,0.3988,COc1ccc2[nH]cc(CCNC(C)=O)c2c1
56,CHEMBL445,NORTRIPTYLINE,263.4,Irritable Bowel Syndrome; Tobacco Use Disorder; Psoriasis,0.4626,0.4853,0.4019,0.5387,CNCCC=C1c2ccccc2CCc2ccccc21
57,CHEMBL7413,METHOHEXITAL,262.3,Unknown,0.4609,0.4993,0.3878,0.5305,C=CCC1(C(C)C#CCC)C(=O)NC(=O)N(C)C1=O
58,CHEMBL436,TOLRESTAT,357.4,Diabetes Mellitus,0.46,0.8522,0.101,0.3935,COc1ccc2c(C(=S)N(C)CC(=O)O)cccc2c1C(F)(F)F
59,CHEMBL446,SULFAMETHAZINE,278.3,Bacterial Infections,0.4527,0.6458,0.2605,0.4511,Cc1cc(C)nc(NS(=O)(=O)c2ccc(N)cc2)n1
60,CHEMBL35,FUROSEMIDE,330.8,Heart Failure; Lung Diseases; Pulmonary Embolism,0.4505,0.8393,0.0915,0.3912,NS(=O)(=O)c1cc(C(=O)O)c(NCc2ccco2)cc1Cl
61,CHEMBL18,ETHOXZOLAMIDE,258.3,Unknown,0.4502,0.6871,0.2375,0.402,CCOc1ccc2nc(S(N)(=O)=O)sc2c1
62,CHEMBL42,CLOZAPINE,326.8,Psychotic Disorders; Anxiety; Dementia,0.4422,0.6097,0.2653,0.461,CN1CCN(C2=Nc3cc(Cl)ccc3Nc3ccccc32)CC1
63,CHEMBL46,ONDANSETRON,293.4,Lecithin Cholesterol Acyltransferase Deficiency; Nausea; Obsessive-Compulsive Disorder,0.4417,0.7137,0.1772,0.4269,Cc1nccn1CC1CCc2c(c3ccccc3n2C)C1=O
64,CHEMBL9,NORFLOXACIN,319.3,Liver Cirrhosis; Osteomyelitis; Bacterial Infections,0.4412,0.7799,0.1196,0.4071,CCn1cc(C(=O)O)c(=O)c2cc(F)c(N3CCNCC3)cc21
65,CHEMBL8,CIPROFLOXACIN,331.4,Anthrax; Infections; Urinary Tract Infections,0.4383,0.783,0.1104,0.4049,O=C(O)c1cn(C2CC2)c2cc(N3CCNCC3)c(F)cc2c1=O
66,CHEMBL22,TRIMETHOPRIM,290.3,Infections; Neoplasms; Idiopathic Pulmonary Fibrosis,0.4377,0.732,0.152,0.4207,COc1cc(Cc2cnc(N)nc2N)cc(OC)c1OC
67,CHEMBL407,FLUMAZENIL,303.3,Sleep Initiation and Maintenance Disorders; Obsessive-Compulsive Disorder; Substance-Related Disorders,0.4276,0.8263,0.0523,0.3808,CCOC(=O)c1ncn2c1CN(C)C(=O)c1cc(F)ccc1-2
68,CHEMBL33,LEVOFLOXACIN ANHYDROUS,361.4,"Infections; Osteomyelitis; Urinary Bladder, Overactive",0.4209,0.8414,0.0249,0.372,C[C@H]1COc2c(N3CCN(C)CC3)c(F)cc3c(=O)c(C(=O)O)cn1c23
69,CHEMBL267744,TICRYNAFEN,331.2,Cardiovascular Diseases,0.4194,0.7822,0.0672,0.3983,O=C(O)COc1ccc(C(=O)c2cccs2)c(Cl)c1Cl
70,CHEMBL411,DIETHYLSTILBESTROL,268.4,"Neoplasms; Prostatic Neoplasms, Castration-Resistant",0.4188,0.7869,0.0694,0.3815,CC/C(=C(/CC)c1ccc(O)cc1)c1ccc(O)cc1
71,CHEMBL43,AMSACRINE,393.5,"Neoplasms; Leukemia; Leukemia, Myeloid, Acute",0.4162,0.8104,0.0378,0.3849,COc1cc(NS(C)(=O)=O)ccc1Nc1c2ccccc2nc2ccccc12
72,CHEMBL32,MOXIFLOXACIN,401.4,"Diabetes Mellitus; Acute Coronary Syndrome; Pulmonary Disease, Chronic Obstructive",0.4083,0.8358,0.005,0.3598,COc1c(N2C[C@@H]3CCCN[C@@H]3C2)c(F)cc2c(=O)c(C(=O)O)cn(C3CC3)c12
73,CHEMBL4,OFLOXACIN,361.4,Hearing Loss; Otitis Media; Diabetic Foot,0.4052,0.8216,0.0108,0.3611,CC1COc2c(N3CCN(C)CC3)c(F)cc3c(=O)c(C(=O)O)cn1c23
74,CHEMBL31,GATIFLOXACIN,375.4,"Conjunctivitis, Bacterial; Osteomyelitis; Infections",0.4012,0.7787,0.0314,0.3858,COc1c(N2CCNC(C)C2)c(F)cc2c(=O)c(C(=O)O)cn(C3CC3)c12
75,CHEMBL2,PRAZOSIN,383.4,"Hypertension; Stress Disorders, Post-Traumatic; Tobacco Use Disorder",0.3965,0.8125,0.0037,0.3499,COc1cc2nc(N3CCN(C(=O)c4ccco4)CC3)nc(N)c2cc1OC
76,CHEMBL430,GEMIFLOXACIN,389.4,Rhinoscleroma; Helicobacter Infections; Bacterial Infections,0.3964,0.8094,0.0049,0.3531,CO/N=C1\CN(c2nc3c(cc2F)c(=O)c(C(=O)O)cn3C2CC2)CC1CN
77,CHEMBL431,SPIRAPRIL,466.6,Cardiovascular Diseases,0.3946,0.7972,0.0051,0.3681,CCOC(=O)[C@H](CCc1ccccc1)N[C@@H](C)C(=O)N1CC2(C[C@H]1C(=O)O)SCCS2
78,CHEMBL6,INDOMETHACIN,357.8,"Pancreatitis; Premature Birth; Spondylitis, Ankylosing",0.3941,0.7491,0.0397,0.393,COc1ccc2c(c1)c(CC(=O)O)c(C)n2C(=O)c1ccc(Cl)cc1
79,CHEMBL408,TROGLITAZONE,441.6,Diabetes Mellitus; Sarcoma,0.3849,0.7936,0.0007,0.3361,Cc1c(C)c2c(c(C)c1O)CCC(C)(COc1ccc(CC3SC(=O)NC3=O)cc1)O2
80,CHEMBL6966,VERAPAMIL,454.6,"Cardiovascular Diseases; Atrial Fibrillation; Osteoarthritis, Knee",0.3709,0.7416,0.002,0.3671,COc1ccc(CCN(C)CCCC(C#N)(c2ccc(OC)c(OC)c2)C(C)C)cc1OC
81,CHEMBL425,OLSALAZINE,302.2,"Spondylitis, Ankylosing",0.3643,0.65,0.0734,0.3747,O=C(O)c1cc(/N=N/c2ccc(O)c(C(=O)O)c2)ccc1O
82,CHEMBL417,EPIRUBICIN,543.5,"Carcinoma, Hepatocellular; Lymphoma, Large B-Cell, Diffuse; Neoplasms, Germ Cell and Embryonal",0.3622,0.7191,0.0021,0.3688,COc1cccc2c1C(=O)c1c(O)c3c(c(O)c1C2=O)C[C@@](O)(C(=O)CO)C[C@@H]3O[C@H]1C[C@H](N)[C@@H](O)[C@H](C)O1
83,CHEMBL409,BICALUTAMIDE,430.4,Prostatic Neoplasms; Prostatic Neoplasms; Prostatic Neoplasms,0.3595,0.6768,0.0224,0.3993,CC(O)(CS(=O)(=O)c1ccc(F)cc1)C(=O)Nc1ccc(C#N)c(C(F)(F)F)c1
84,CHEMBL23,DILTIAZEM,414.5,Metabolic Syndrome; Atrial Fibrillation; Cardiovascular Diseases,0.3579,0.706,0.0014,0.3747,COc1ccc([C@@H]2Sc3ccccc3N(CCN(C)C)C(=O)[C@@H]2OC(C)=O)cc1
85,CHEMBL49,BUSPIRONE,385.5,"Scleroderma, Systemic; Cocaine-Related Disorders; Child Development Disorders, Pervasive",0.3578,0.7275,0.0007,0.3326,O=C1CC2(CCCC2)CC(=O)N1CCCCN1CCN(c2ncccn2)CC1
86,CHEMBL27,PROPRANOLOL,259.4,"Carcinoma, Hepatocellular; Cardiovascular Diseases; Pulmonary Disease, Chronic Obstructive",0.3487,0.676,0.0176,0.3564,CC(C)NCC(O)COc1cccc2ccccc12
87,CHEMBL421,SULFASALAZINE,398.4,"Spondylitis, Ankylosing; Peripheral Nervous System Diseases; Arthritis, Rheumatoid",0.3365,0.676,0.0007,0.3294,O=C(O)c1cc(/N=N/c2ccc(S(=O)(=O)Nc3ccccn3)cc2)ccc1O
88,CHEMBL423,BETAXOLOL,307.4,"Cardiovascular Diseases; Glaucoma, Open-Angle; Ocular Hypertension",0.3328,0.6707,0.0002,0.3221,CC(C)NCC(O)COc1ccc(CCOCC2CC2)cc1
89,CHEMBL266349,MELAGATRAN,429.5,Thrombosis,0.3309,0.5274,0.069,0.4616,N=C(N)c1ccc(CNC(=O)[C@@H]2CCN2C(=O)[C@H](NCC(=O)O)C2CCCCC2)cc1
90,CHEMBL422,TRIFLUOPERAZINE,407.5,"Psychotic Disorders; Anemia, Diamond-Blackfan",0.3296,0.5794,0.0287,0.4317,CN1CCN(CCCN2c3ccccc3Sc3ccc(C(F)(F)F)cc32)CC1
91,CHEMBL269732,TACROLIMUS ANHYDROUS,804.0,"Leukemia, Lymphocytic, Chronic, B-Cell; Carcinoma, Hepatocellular; Hodgkin Disease",0.3254,0.6387,0.0,0.3497,C=CC[C@@H]1/C=C(\C)C[C@H](C)C[C@H](OC)[C@H]2O[C@@](O)(C(=O)C(=O)N3CCCC[C@H]3C(=O)O[C@H](/C(C)=C/[C@@H]3CC[C@@H](O)[C@H](OC)C3)[C@H](C)[C@@H](O)CC1=O)[C@H](C)C[C@@H]2OC
92,CHEMBL428,TROVAFLOXACIN,416.4,Osteomyelitis; Bacterial Infections,0.3215,0.5825,0.0113,0.4198,N[C@@H]1[C@H]2CN(c3nc4c(cc3F)c(=O)c(C(=O)O)cn4-c3ccc(F)cc3F)C[C@@H]12
93,CHEMBL7568,QUINACRINE,400.0,"Colorectal Neoplasms; Carcinoma, Renal Cell; Carcinoma, Non-Small-Cell Lung",0.3209,0.5772,0.0147,0.4209,CCN(CC)CCCC(C)Nc1c2ccc(Cl)cc2nc2ccc(OC)cc12
94,CHEMBL442,ERGOTAMINE,581.7,"Hypotension, Orthostatic; Migraine Disorders",0.3054,0.4185,0.0689,0.5519,CN1C[C@H](C(=O)N[C@]2(C)O[C@@]3(O)[C@@H]4CCCN4C(=O)[C@H](Cc4ccccc4)N3C2=O)C=C2c3cccc4[nH]cc(c34)C[C@H]21
95,CHEMBL6995,PRACTOLOL,266.3,Cardiovascular Diseases,0.2996,0.5787,0.0027,0.335,CC(=O)Nc1ccc(OCC(O)CNC(C)C)cc1
96,CHEMBL38,TRETINOIN,300.4,"Acne Vulgaris; Leukemia, Myeloid, Acute; Lymphoma",0.2869,0.5537,0.0008,0.3254,CC1=C(/C=C/C(C)=C/C=C/C(C)=C/C(=O)O)C(C)(C)CCC1
97,CHEMBL24,ATENOLOL,266.3,Angina Pectoris; Hypertension; Myocardial Infarction,0.2842,0.5161,0.0188,0.3512,CC(C)NCC(O)COc1ccc(CC(N)=O)cc1
98,CHEMBL413,SIROLIMUS,914.2,Precursor Cell Lymphoblastic Leukemia-Lymphoma; Kidney Diseases; Cardiovascular Abnormalities,0.28,0.49,0.0,0.4201,CO[C@H]1C[C@@H]2CC[C@@H](C)[C@@](O)(O2)C(=O)C(=O)N2CCCC[C@H]2C(=O)O[C@H]([C@H](C)C[C@@H]2CC[C@@H](O)[C@H](OC)C2)CC(=O)[C@H](C)/C=C(\C)[C@@H](O)[C@@H](OC)C(=O)[C@H](C)C[C@H](C)/C=C/C=C/C=C/1C
99,CHEMBL13,METOPROLOL,267.4,beta-Thalassemia; Cardiovascular Diseases; Atrial Fibrillation,0.2763,0.5267,0.001,0.326,COCCc1ccc(OCC(O)CNC(C)C)cc1
100,CHEMBL429,LABETALOL,328.4,Cardiovascular Diseases; Hypertension; Pre-Eclampsia,0.2664,0.5093,0.0001,0.3133,CC(CCc1ccccc1)NCC(O)c1ccc(O)c(C(N)=O)c1
